label,statement,subjects,superlabel
True,Between 1980 and 2010 water usage in Georgia dropped even as the states population grew .,"environment,water",health_science
True,Were losing thousands of (veterans) waiting on line because they cant get speedy health care from the Veterans Administration .,"health-care,veterans",health_science
False,Health insurance costs for Floridians are up 30 percent or more .,health-care,health_science
False,Says Lamar Smith sponsored the bill that funded Obamacare .,"federal-budget,health-care,space",health_science
True,The LGBT community is more often the victims of hate crimes than any other recognized group .,"crime,gays-and-lesbians",health_science
False,Back door gun control is in full effect in the United States due to Obamas Environmental Protection Agency .,"environment,guns,health-care,public-health",health_science
False,Says Donald Trump said the government is going to pay for everybody to have health care .,health-care,health_science
True,Barack Obama s health care plan would leave 15-million Americans out .,health-care,health_science
True,Floridas proposed amendment for medical marijuana would allow people who alleged minor ailments such as muscle spasms neck pain back pain and even menstrual cramps (to qualify) for government-sanctioned pot-smoking .,"drugs,health-care,marijuana",health_science
False,Some doctors say Ebola can be transmitted through the air by a sneeze or some cough .,"ebola,health-care,public-health",health_science
True,We the bishops of the United States - can you believe it - in 1919 came out for more affordable more comprehensive more universal health care .,"health-care,religion,sexuality",health_science
False,Forty years ago hardly anybody in the country had health insurance .,health-care,health_science
False,For every Kentuckian that has enrolled in Obamacare 40 have been dropped from their coverage .,"corrections-and-updates,health-care",health_science
True,Floridas high school graduation rates continue to increase at the fastest rate in the nation with Florida leading the nation in the rate of Hispanic graduates .,"diversity,education",health_science
True,House Republicans pledged to introduce a bill to reform Americas health care system but the party of no has . . . failed to produce legislation .,health-care,health_science
True,Polls show Americans are overwhelmingly opposed to Obamacare especially the individual mandate .,health-care,health_science
False,In Texas we teach both creationism and evolution in our public schools .,"education,science",health_science
False,We have been confronted with an unexpected storm that has hit the metropolitan area .,weather,health_science
True,The water quality in the ocean is perfect . Its been tested up and down every ocean shore in New Jersey .,"environment,water",health_science
False,A majority of Americans since Harry Truman days support single-payer health insurance or full Medicare for all .,"federal-budget,health-care,history,medicare,polls,public-health",health_science
True,Says more than 2 million Oregonians have received important medical services because of his health plan .,health-care,health_science
False,Stimulus money funded a government board that made recommendations that would cost 378000 jobs and $28.3 billion in sales .,"children,health-care",health_science
True,Says PETA is using this really fancy drone to follow hunters around in some places in other countries .,"animals,public-safety,technology",health_science
False,Says Mitt Romney backed a bill that outlaws all abortions even in cases of rape and incest .,"abortion,message-machine-2012",health_science
False,20 percent of the time (smart guns) wont work .,"guns,technology",health_science
True,There are tens of thousands of homes right here in California where you turn on the faucet but you cant drink the water .,"agriculture,consumer-safety,environment,public-health,water",health_science
True,Any government-run public plan . creates an entitlement that will cost another $1 trillion over the next 10 years .,health-care,health_science
True,North Koreahas over two-dozennuclear warheads .,nuclear,health_science
True,Emergency rooms account for 2 percent of all health care spending .,"health-care,pundits",health_science
False,We had (a bill) in Florida where we now are prohibiting doctors to talk - particularly pediatricians - to talk to their patients about gun safety in the home .,"guns,health-care",health_science
True,Chris Koster opposed protecting the women of Missouri because he was one of only four senators to vote against a bill ending the practice of making rape victims pay for their own rape kits .,"crime,women",health_science
True,Says there have been no cases of wolves killing people in Rocky Mountain states .,environment,health_science
False,Jeff Merkley was the deciding vote on Obamacare which in Oregon has been an unmitigated disaster .,health-care,health_science
True,The new beverage tax will increase the cost of sodas juice drinks sports drinks iced teas and flavored water up to 50%.,"health-care,public-health,taxes",health_science
True,Legal prescription drugs statistically kill 100000 people a year (but) there are no documented deaths due to marijuana .,"drugs,marijuana",health_science
True,A 5 percent increase in domestic production would increase the world supply by less than 1 percent and do almost nothing to our dependence on foreign oil . This would also have virtually no effect on the price of gas at the pump .,"environment,oil-spill",health_science
False,The United States has a record number of abortions year after year after year .,abortion,health_science
False,Says the first word spoken from the moon was Houston .,space,health_science
True,The U.S. has a record number of oil rigs operating right now more working oil and gas rigs than the rest of the world combined .,energy,health_science
True,The gun epidemic is the leading cause of death of young African-American men more than the next nine causes put together .,"diversity,guns,public-health",health_science
True,Under Obamacare premiums have doubled and tripled in Wisconsin .,health-care,health_science
True,Says the media distortedwhat happened with a baby at his rally .,"candidates-biography,children",health_science
True,American oil production is at its highest level since 2003 .,energy,health_science
True,Floridas proposed medical marijuana amendment would make Florida one of the most lenient medical-marijuana states allowing use for limitless other conditions specified by any physician .,"drugs,health-care,marijuana,states",health_science
False,Seventy percent of the people in the state of New Jersey want marriage equality .,"gays-and-lesbians,marriage",health_science
False,The bill also provides full federal funding for abortions,"abortion,health-care",health_science
True,We spend more on health care than any other country but we re ranked 47th in life expectancy and 43rd in child mortality .,health-care,health_science
True,Volunteer firefighters and communities they serve in Georgia and elsewhere are being devastated by Obamacare .,health-care,health_science
True,I believe we should have tax on carbon and deal aggressively with climate change . That is not (Hillary Clintons)position .,"cap-and-trade,climate-change,energy,environment",health_science
True,Only four countries in the world allow abortions after 20 weeks of pregnancy .,abortion,health_science
True,Today Russia holds many of our most precious national security satellites at risk before they ever get off the ground .,space,health_science
False,Religious groups like Knights of Columbus have been forced to allow same-sex marriage ceremonies in their facilities against their beliefs .,"diversity,families,gays-and-lesbians,legal-issues,marriage,religion",health_science
True,In the period from 2007 to 2011 the Office of Health Insurance Commissioner reported an 18 percent decline in the states total medical spending .,health-care,health_science
False,If women seeking an abortion see their ultrasound the odds are pretty high theyre going to keep the baby .,"abortion,children,health-care,public-health,technology,women",health_science
True,Says Connie Mack voted to redefine rape as forcible rape .,"abortion,corrections-and-updates,debates,women",health_science
False,Says the national health care law puts federal bureaucrats between an American citizen and her doctor .,health-care,health_science
True,On whether humans contribute to global warming,"climate-change,environment",health_science
True,In 2010 2694 young people were killed by gunfire . 1773 were victims of homicide ; 67 were elementary school-age children .,"children,guns",health_science
False,Obamacare is one big fat VA system .,"health-care,veterans",health_science
False,Under the Iran nuclear deal we give them $150 billion we get nothing .,"foreign-policy,nuclear",health_science
True,Says Your kid just ate 16 packs of sugar .,"county-government,public-health",health_science
True,Says Iowa Senate candidate Joni Ernst promises to shut down the Department of Education and abolish the EPA .,"education,environment",health_science
True,Georgia residents file the most insurance claims for lightning strikes in the country .,weather,health_science
True,After initially agreeing with Republicans on an amount for Zika funding Democrats derailed it .,"abortion,public-health",health_science
True,Nearly one in five women in America has been a victim of rape or attempted rape .,"crime,criminal-justice,sexuality,women",health_science
True,This (SCHIP) is socialized medicine . It is going to go to families that make $60000 a year . Those aren t poor children .,health-care,health_science
False,Says Connie Mack failed to pay his child support .,"candidates-biography,children,families",health_science
True,Says David Jolly lobbied on a plan by Rep . Paul Ryan that would turn Medicare into a voucher program .,medicare,health_science
True,Many state and federal agencies have such navigators involved in helping folks maneuver through the often complex processes associated with filing benefits claims for example - even buying health insurance .,health-care,health_science
False,I have tremendous support from women .,"elections,women",health_science
False,Says theres not much evidence to suggest that people have (contributed to global warming) or can do very much to change anything .,"climate-change,environment",health_science
True,A poll found that 20% of young adults use (smartphones) during sex .,"sexuality,technology",health_science
False,We know that President Obama stole over $500 billion out of Medicare to switch it over to Obamacare .,"federal-budget,health-care,medicare",health_science
False,This is the year Florida becomes a majority minority state .,"census,diversity",health_science
False,Says President Barack Obamas health care law is expected to destroy 2.3 million jobs .,health-care,health_science
True,In Texas sexting is a felony sex offense for teenagers that can mean up to 10 years in prison .,"children,crime,criminal-justice,technology",health_science
True,[A]n extra 8 million Americans [are] projected to join state Medicaid programs in the next few years .,health-care,health_science
True,Polls now show a majority of Catholics favor marriage equality .,"gays-and-lesbians,marriage",health_science
True,In Ohio more than half the providers of safe and legal abortion have had to shut down since Gov . John Kasich took office in 2011 .,abortion,health_science
False,Members of Congress specifically exempted themselves from many of the laws they have passed such as being exempt from any fear of prosecution for sexual harassment . (and) from the healthcare reform .,"congress,health-care",health_science
True,Republicans would give seniors a (Medicare) voucher that limits whats covered costing seniors as much as $6400 more a year .,"health-care,medicare",health_science
True,Ninety-five percent of Oregonians now have health insurance coverage tens of thousands for the very first time .,health-care,health_science
True,A gas tax holiday is a gimmick that every economist says will just go into the pockets of the oil companies .,energy,health_science
False,Marco Rubio thinks that government shouldn t be in the health care business at all .,health-care,health_science
True,Swaziland has the highest rate of HIV infection in the world .,public-health,health_science
True,Studies have consistently failed to establish the existence of a link between the harshness of a countrys drug laws and its levels of drug use .,"crime,drugs",health_science
False,The Earth is not warming .,"climate-change,corrections-and-updates,environment,weather",health_science
True,When I served as City Commissioner we made great strides we successfully fought for and won adding women and people of color to the Fire Bureau .,diversity,health_science
True,Over 97 percent of the scientific community believe that humans are contributing to climate change .,"climate-change,science",health_science
False,Nevada is still a state that is 80 percent white voters .,"diversity,elections",health_science
True,The health care bill will subsidize families of four that make more than $80000 a year .,health-care,health_science
False,The health care law imposes a federal mandate requiring middle-class Americans to buy health insurance whether they can afford it or not .,health-care,health_science
True,Theres a 1.5 percent to 2 percent overhead in Medicare . The insurance companies have a 20 percent to 30 percent overhead .,"health-care,medicare",health_science
True,Josh Mandel used to be pro-choice now hes anti-choice . He used to be sympathetic towards gay and lesbians and now hes [not].,"abortion,gays-and-lesbians",health_science
True,Says women who need a sonogram in the eighth to 10th week of pregnancy have to get a transvaginal sonogram .,"abortion,health-care,women",health_science
True,Says David Dewhurst went out for drinks during Senate debate on abortion bill .,"abortion,corrections-and-updates",health_science
False,Cuccinelli wants to make all abortion illegal even in cases of rape and incest even to protect a womans health .,abortion,health_science
True,By the time you drink your coffee an elephant is killed for its ivory tusks .,"animals,environment,trade",health_science
True,About half the people who would qualify for Medicaid expansion in Florida can buy a health care plan for $30 a month on the federal health care exchange .,"health-care,medicaid",health_science
False,Insurers delayed an Illinois man s treatment and he died because of it .,health-care,health_science
False,Since being elected (Tom Barrett) has dumped 8.2 billion gallons of raw sewage into Lake Michigan .,environment,health_science
True,Both China and Japan have surpassed us with Japanese cars now getting an average of 45 miles to the gallon .,energy,health_science
True,President Barack Obama deserves to be called the most successful food stamp president in American history because 47 million Americans are on food stamps .,"economy,families,hunger",health_science
False,Under the Obama plan . . . all the health care in this country is eventually going to be run by the government .,health-care,health_science
True,Says Obama called Medicaid broken four years ago .,"health-care,medicaid",health_science
True,Will (HB2)threaten federal funding for public schools under Title IX No according to a federal court which has looked at a similar issue .,"education,gays-and-lesbians,government-regulation,sexuality",health_science
False,Some of the things that (Megyn Kelly) said I didnt say .,women,health_science
True,Only 14 percent of Catholics agree with the Vaticans position that abortion should be illegal .,"abortion,polls,religion,women",health_science
False,Only three in 10 Texas doctors are currently accepting new Medicaid patients .,"federal-budget,health-care,medicaid,public-health,state-budget",health_science
False,Says an appointed board created under Obamacare will have the ability to come between you and your doctor in determining the best treatment options for you,health-care,health_science
True,200000 students attempt suicide every year on college campuses .,"education,guns,health-care,public-health",health_science
True,For the first time in eight years our budget also increases funding for persons with disabilities by $36 million to help more disabled people receive community-based services .,"disability,medicaid,state-budget",health_science
False,Mayor White has major stake in Barnett Shale production company .,"economy,energy,environment,transparency",health_science
False,Rep . Jim Renaccis plan to end Medicare also puts nursing home care for 3000 seniors in the district in immediate jeopardy .,"health-care,medicaid,medicare",health_science
True,The federal government has made investments in science and technology inventing the products that led to the creation of Google .,technology,health_science
True,Weve seen more anti-womens choice bills introduced in the first half of this session than weve seen in the last three General Assemblies .,abortion,health_science
True,Barack Obama accepted $200000 from executives and employees of oil companies .,energy,health_science
False,Obamacare could cause 20 million people to lose their current coverage .,"health-care,message-machine-2012",health_science
True,Barack Obama s nominee for regulatory czar has advocated a Fairness Doctrine for the Internet that would require links to opposing opinions .,"legal-issues,technology",health_science
False,Planned Parenthood has now (been) found to also illegally sell baby parts .,abortion,health_science
True,Anyone can die of a toothache .,"health-care,medicaid",health_science
True,On oil drilling off Floridas coast,"environment,oil-spill",health_science
True,If parents don t have health insurance that Senator Obama wants them to have (for their children) they will be fined .,health-care,health_science
False,Ann Kuster supports the government takeover of healthcare which robs Medicare of over $700 billion .,"health-care,message-machine-2012",health_science
False,This (Ebola) is not as bad as SARSwas in 2003 .,"ebola,health-care,public-health",health_science
False,A couple of debates ago (Donald Trump) said if you dont support socialized health care youre heartless .,health-care,health_science
False,Its four or five states where the number of insurance options have narrowed under the Affordable Care Act .,health-care,health_science
True,Says a 1915 referendum on womens right to vote went down in New Jersey . And it took the Legislature to pass it .,women,health_science
False,Says U.S. House candidate Carlos Curbelo supported ending the Medicare guarantee .,medicare,health_science
False,A report by the US General Accountability Office (GAO) in 2008 found that the disposal of Katrina wastes by AshBritt in the south resulted in the creation of contaminated sites along the Gulf Coast and two new Superfund sites in New Orleans .,environment,health_science
True,Every 20 seconds a child dies because they lack access to clean water and sanitation .,water,health_science
False,Says his Patient OPTION Act is the only Republican plan that completely repeals Obamacare and it takes the federal bureaucrat out of decisions for you .,health-care,health_science
True,Solar and wind energy are both cheaper than nuclear right now .,"energy,environment",health_science
True,Says Hillary Clinton wonhealth care for 8 million children .,"health-care,public-health",health_science
False,Says abortion is the most common surgery in our country .,abortion,health_science
True,The University of Texas is starting the first medical school at a major Tier One university in the last 50 years .,"education,health-care,public-health",health_science
True,Teenage births cost Texas taxpayers $1.1 billion in health care foster careand lost tax revenue in 2010 alone .,"abortion,sexuality",health_science
False,It still had not gotten terrible on the roads by 2 to 3 p.m. Tuesday .,weather,health_science
False,We came out against Deepwater and everybody is now paying for [the project] in their electric bills .,"energy,environment",health_science
True,Says Obama administration delay of health care laws employer mandate affects about 1 percent of the American workforce .,health-care,health_science
False,Said his mother had to fight with health insurance companies for treatment because of a pre-existing condition .,"candidates-biography,health-care",health_science
True,Mike Pence voted against expanding the Childrens Health Insurance program which Hillary helped to start .,"federal-budget,health-care,medicaid,medicare,poverty,public-health",health_science
True,More people hunt and fish in Texas in a given year than attend the . games of the Dallas Cowboys the Dallas Mavericks the Houston Texans and the Houston Rockets combined .,"environment,recreation",health_science
False,Says Scott Walker tried to pass a law to allow pharmacists to block womens access to birth control .,"health-care,message-machine,women",health_science
False,When they passed Obamacare they put a bailout fund in Obamacare . We led the effort and wiped out that bailout fund .,health-care,health_science
True,Says Hillary Clinton and millennials have the same positions on climate change abortion rights immigration reform gay rights and college affordability . Donald Trump doesnt .,"abortion,climate-change,education,gays-and-lesbians,immigration",health_science
False,A defense bill includes language that would require military hospitals to provide abortions on demand .,abortion,health_science
True,We are the only major country on Earth that doesnt guarantee health care to all people as a right .,health-care,health_science
True,Do you know that statistically when you take the SAT a second time one third of the people that take the SAT even if theyve been studying will get a lower score than they did the first time around,"children,education",health_science
False,On HealthCare.Gov Texan Mark Sullivan found a good health insurance plan that includes dental for less than $80 a month .,"corrections-and-updates,health-care",health_science
True,I m proud to have had a 100 percent pro-life voting record .,abortion,health_science
False,Says a Canadian provincial prime minister came to Ohio for his medical treatment because of the delay in Canadian health care which would have endangered his life .,health-care,health_science
False,I would love to see us have in this country what I helped lead in Arkansas . Amendment 65 (which) says that we believe life begins at conception and that we ought to do everything in the world possible to protect it until its natural conclusion .,abortion,health_science
False,If we went back to the obesity rates that existed back in the 1980s the Medicare system over several years could save as much as a trillion dollars .,"health-care,medicare",health_science
True,Domestic violence is seen as a pre-existing health condition and women had to pay 50 percent more for health care because of gender ratings but under Obamacare all of that is over .,"crime,government-regulation,health-care,women",health_science
True,We are the only industrialized nation that relies heavily on a for-profit medical insurance industry to provide basic health care .,health-care,health_science
True,90 percent of all pain medications are prescribed in the United States .,drugs,health_science
True,Congress secured special Obamacare rules to prevent their healthcare costs from rising .,"congress,health-care",health_science
False,As a result of Chris Sununus vote against a Planned Parenthood contract nearly 3000 fewer women and families statewide accessed health care for birth control cancer screenings and annual exams .,"abortion,health-care,voting-record",health_science
False,Says she voted against the Medicare Part D prescription drug program because it was unfunded .,"candidates-biography,health-care,medicare",health_science
True,Proposed tax changes are a handout to BP .,"cap-and-trade,climate-change,corporations,energy,environment,foreign-policy,message-machine,oil-spill",health_science
True,For the cost of the Iraq War we couldve ended world hunger for 30 years .,"hunger,iraq",health_science
True,Before this law was passed Americans were told they could keep their current health care plans . After it became law the administration issued regulations stating nearly half of Americans would lose their current plan .,health-care,health_science
True,I built the last nuclear plant not only in the state but in the country .,"energy,nuclear",health_science
True,When you have 8000 veterans a year committing suicide then you have a serious problem .,"public-health,veterans",health_science
False,In a few months this deal would give Iran $150 billion for its $300 billion to $400 billion economy which is like $8 trillion flowing into the United States treasury .,"foreign-policy,nuclear",health_science
False,This president . could have gotten crippling sanctions against Iran . He did not .,"foreign-policy,nuclear",health_science
True,Says the majority of Americans support gay marriage .,"gays-and-lesbians,marriage",health_science
True,After prenatal diagnosis 90 percent of Down syndrome children in America are aborted .,"abortion,health-care",health_science
True,Government subsidies for renewable energies such as wind and solar are 100 times greater than those given to gas and coal and 50 times greater than what the nuclear industry enjoys .,energy,health_science
True,A small majority of Americans dont think they like the Affordable Care Act but a large majority of Americans dont want to do away with the protections that are in the Affordable Care Act .,"health-care,polls",health_science
