label,statement,subjects,superlabel
True,25 percent of all drug-related fatal vehicle accidents in the U.S. involve marijuana .,"drugs,health-care",health_science
False,On support for the Affordable Care Act (Obamacare).,health-care,health_science
True,Kendrick Meek is the only candidate who has consistently been against expanded drilling .,energy,health_science
False,The growth in health care costs has been reined in through the Affordable Care Act .,health-care,health_science
True,While the sequester is in effect the federal government is still funding a study on duck penises .,"animals,corrections-and-updates,federal-budget,science,sexuality",health_science
False,President Obama s bill won t bring down the costs (of health care) for average Americans - or really for very few Americans if any .,health-care,health_science
False,A lot of the problems with forest fires . is because of bad policy (not to clear out the forests) that was put in place by environmentalists .,"environment,natural-disasters,weather",health_science
True,Palin supports aerial hunting of wolves and other wildlife .,environment,health_science
True,A typical married couple will contribute $119000 into Medicare but will receive $357000 in Medicare benefits over their lifetimes .,"corrections-and-updates,deficit,health-care,medicare",health_science
True,Opinion polls show that the majority of Americans and the majority of New Jerseyans favor marriage equality for same sex couples .,"gays-and-lesbians,marriage",health_science
False,I didn t campaign on a public option .,"elections,health-care",health_science
True,We just dont want to get to be like Louisiana where you have drive-up daiquiri shops .,Alcohol,health_science
True,Californians consume 40 percent less energy per person than the national average,"energy,environment",health_science
False,Says in Canada the number of CT scan machines per 1000 people is like one-tenth of what we have here in this country . Thats why people have to wait .,health-care,health_science
True,Says Lake Erie contains more native fish than all the other Great Lakes combined .,"environment,recreation,water",health_science
True,Cincinnati is already one of the biggest cities in the country to run 100 percent on clean energy .,energy,health_science
True,Less than 5 percent of registered users in states allowing medical marijuana have cancer or AIDS .,"health-care,marijuana",health_science
False,We are seeing dramatic rate cuts to Medicare that will affect seniors ability to keep their doctor hospital and prevention services .,medicare,health_science
True,As a student at Occidental College in Los Angeles from 1979 to 1981 there were days where folks couldnt go outside . because of all the pollution in the air .,"environment,history,public-health",health_science
True,If someone is in a room that has measles and leaves and you walk in two hours later you could get measles from that person .,"health-care,public-health",health_science
True,Says the Senate will have a record number of female senators in 2013 .,"history,women",health_science
True,Virtually no Republican in Washington accepts climate change science .,"candidates-biography,climate-change,environment",health_science
False,I am the only U.S. Senate candidate who spoke out against bombing Syria and who challenged Georgias governor and insurance commissioner over obstruction to the Affordable Care Act .,"foreign-policy,health-care",health_science
True,In 2010 uninsured voters made up about 5 percent of the electorate .,"congress,health-care",health_science
True,Marriage decreases the probability of child poverty by 82 percent .,"children,families,marriage,poverty",health_science
True,It is a greater crime to have an untagged alligator than to host an open house party (for kids).,"Alcohol,animals,children,crime",health_science
True,Over the last six years the state of Illinois spent about $320 million on illegal immigrants .,"health-care,immigration",health_science
True,If Florida expanded Medicaid some studies indicate it would create about 120000 jobs .,medicaid,health_science
True,One extra year of schooling for girls reduces infant mortality rates among their children by up to 10 percent .,"children,education,public-health,women",health_science
True,Oil money from federal leases can only be used to clean up the mess and damages from drilling .,environment,health_science
False,Says Mitch McConnell voted to raise Medicare costs for a current Kentucky senior by $6000 .,"federal-budget,health-care,medicare",health_science
False,Im 59 . In either Canada or Great Britain if I broke my hip I couldnt get it replaced .,health-care,health_science
True,Well you know the Teamsters wanted to drill in Alaska . I voted against drilling in Alaska . So it s not like I m a slam dunk on every issue .,energy,health_science
False,HIV/AIDS among women is skyrocketing in Austin .,"city-budget,city-government,health-care,public-health,women",health_science
True,Says Craig Huey called Planned Parenthood a murder mill .,"abortion,medicare",health_science
False,Obamacare doesnt require members of Congress to abide by the same rules that all of the other Americans do .,health-care,health_science
True,Says she is entering in the most diverse class ever of U.S. Representatives,"congress,diversity",health_science
False,In other jurisdictions where (a domestic partnership registry) has been enacted we have seen that fewer people enter into marriage .,"gays-and-lesbians,marriage",health_science
False,U.S. Rep . John Barrow of Georgia has helped support the implementation of Obamacare .,health-care,health_science
True,More than 72 percent of children in the African-American community are born out of wedlock .,"children,diversity,families,marriage,pundits,sexuality",health_science
True,Seventy percent of all Texans are overweight or obese .,"children,health-care,public-health",health_science
False,Say water fluoridation started in Nazi Germany ghettos and death camps to pacify the Jews .,"health-care,history,public-health,science,water",health_science
True,Big rooftop solars plan forces Nevada families who dont have solar panels to pay higher power bills to subsidize rooftop solar .,energy,health_science
True,As a candidate President Obama declared that everyone deserves access to reproductive health care that includes abortion and vowed that this right would be at the heart of his health care reform plan if elected president .,"abortion,health-care",health_science
True,Says Ann Kirkpatrick walked out on constituents when questioned on the Affordable Care Act .,health-care,health_science
True,The Iran deal violates promises the president made to the American people . . It is not an anytime anywhere inspection process .,"foreign-policy,nuclear",health_science
False,Says Barack Obama put in place a board that can tell people ultimately what treatments theyre going to receive .,"debates,medicare",health_science
True,Says by 4th grade 86 percent of African-American boys and 82 percent (of) Hispanic boys are reading below proficiency levels .,"diversity,education",health_science
True,Says U.S. Senate candidate Tommy Thompson says hell do away with Medicare .,"medicare,message-machine-2012",health_science
False,In Congress Tom Barrett voted to allow abortions through the ninth month just moments before the baby is born .,"abortion,message-machine",health_science
True,[Mitt] Romney and [Brendan] Doherty certainly have a lot in common like flip-flopping on abortion - in Dohertys case in a little over a week .,"abortion,women",health_science
False,Responding to a major snow event in Atlanta would be like Kansas City Mo . responding to a major earthquake .,weather,health_science
False,Weve had the lowest health care inflation in history because of Obamacare .,"economy,health-care,medicaid,medicare",health_science
True,Despite President Barack Obamas promise to cut healthcare costs the average cost of a family policy is up $1300 .,"health-care,message-machine-2012",health_science
False,Says he didnt call Dr . George Tiller a baby killer as liberal groups charge but was merely reporting what some prolifers branded him .,"abortion,pundits",health_science
True,A Cornell University research study concludes that ethanol generates a 29 percent energy loss meaning it takes more than a gallon of gasoline to produce a gallon of ethanol .,"agriculture,energy,environment,science",health_science
True,Half of all adults have a pre-existing condition that could affecttheir health care coverage .,health-care,health_science
False,UPS left 15000 employees spouses without health insurance and told them to go on an exchange with no employer subsidy .,"families,health-care",health_science
False,Says the goal of the Affordable Care Act was to get 30 million people insured but it only got 7 million .,health-care,health_science
True,Medicare spends $15-billion a year on subsidies to insurance companies .,health-care,health_science
True,Theres no scientific conclusion that (being gay) is genetic .,"gays-and-lesbians,science",health_science
True,Says Gov . Rick Scott returned $1 million in federal funding that would have helped the state cover the cost of overseeing insurance rates under the new health care law .,health-care,health_science
True,The Republicans have demanded deep cuts in education . Theyve demanded cuts in cancer research and other research to find cures and treatments to diseases .,"education,federal-budget,health-care,science,abc-news-week",health_science
True,If Obamacare is fully implemented 30 million people will still be without health insurance .,health-care,health_science
False,Says Sheldon Whitehouse said on Senate floor : Everybody in Rhode Island who disagrees with me about Obamacare is an Aryan is a white supremacist .,health-care,health_science
True,Says that in fiscal year 2010 nearly 80 percent of women served in the Texas Womens Health Program received services from a provider other than a Planned Parenthood clinic .,"abortion,health-care,public-health,women",health_science
False,We re building a nearly $40-billion natural gas pipeline which is North America s largest and most expensive infrastructure project ever .,energy,health_science
True,He s (Romney) the one who said that he would be to the left of Teddy Kennedy on gay rights .,gays-and-lesbians,health_science
False,Says George Soros and Bill Gates are funding a bioweapons lab in Sierra Leone that caused the Ebola outbreak .,"ebola,public-health",health_science
True,To comply with non-discrimination laws the government is forcing people in business to make wedding cakes for anyone .,"civil-rights,diversity",health_science
True,Were the Sunshine State and were hardly doing any solar energy production .,energy,health_science
True,We also have in a park thats not far from here an ability to build a reservoir that can hold a 30-day water supply for the city of Atlanta .,water,health_science
False,Says Gov . Jim Doyle and the DNR have not put hunters first and mismanaged the deer herd ; as a result the deer population has dwindled .,"environment,recreation",health_science
True,Nearly 45 percent of the women who receive health screenings through (the Womens Health Program) do so at a Planned Parenthood health center .,"abortion,health-care,public-health,women",health_science
True,Last year we produced 14 percent less oil on public lands than we did the year before .,energy,health_science
True,Says Georgia Power customers pay 10 percent to 15 percent below the national average for electricity .,energy,health_science
True,Nothing in any of the Democrat bills would require individuals to verify their citizenship or identity prior to receiving taxpayer-subsidized benefits .,"health-care,immigration",health_science
True,Sen . George LeMieux voted to let oil companies off the hook and overturn pollution rules .,"climate-change,energy,environment,message-machine,oil-spill",health_science
False,On adoption by gay couples,"children,families,gays-and-lesbians",health_science
False,Of hospitals in Rick Scotts Columbia/HCA health care company A top executive said they even turned away a poor man and left him to die outside their door .,"health-care,message-machine",health_science
True,With the resources it takes to execute just over three months of the Iraq war we could fully fund the expansion of health care for needy children that Bush vetoed .,health-care,health_science
False,Nobodys addicted to marijuana .,"drugs,marijuana",health_science
False,Says Reps . Rush Holt Frank Pallone and Bill Pascrell are willing to jeopardize seniors access to coverage by gutting $741 billion from Medicare to pay for a big-government healthcare takeover .,"health-care,medicare",health_science
False,Russ Feingold voted against the law that protected our lakes and was the only Great Lakes senator to vote no .,"energy,environment,message-machine",health_science
False,Barack Obama has consistently voted against tougher penalties for criminals .,"crime,drugs,families,marijuana,public-safety",health_science
False,Nobody has been talking about it (Medicaid fraud) focused on it or paying attention to it .,"health-care,medicare",health_science
True,90 percent of fires in Arizona are human-caused .,fires,health_science
True,More than 1 million Texans live without affordable health care because Rick Perry failed to partner with the Legislature to find a Texas solution to closing the coverage gap .,"corrections-and-updates,health-care",health_science
False,The Clean Power Plan is something that Sen . Sanders has said he would delay implementing .,"climate-change,environment",health_science
True,Millions of dollars are spent by Planned Parenthood to elect Democrats to the House of Representatives and the Senate .,"abortion,campaign-finance,elections,federal-budget,health-care,women",health_science
True,The biggest job of the surgeon general is to translate health care and health care needs into plain English .,health-care,health_science
False,We reduced abortion . We increased adoptions by 135 percent .,abortion,health_science
True,Says U.S. Senate rival Tommy Thompson said he wants to do away with Medicare .,"federal-budget,health-care,medicare",health_science
False,In 2013 Dan Patrick voted against funding to test the backlog of rape kits allowing rapists to walk free .,"abortion,crime,criminal-justice,women",health_science
True,The claim . that we plan to set up panels of bureaucrats with the power to kill off senior citizens . is a lie plain and simple .,health-care,health_science
False,Recently Rick Scott closed 30 womens health care centers across the state .,"health-care,state-budget,women",health_science
False,Says President Barack Obama has put (up) a stop sign against oil drilling against any kind of exploration offshore or in Alaska .,"energy,environment,oil-spill",health_science
True,The RESTORE Act started as an effort to dedicate as much BP fine money as possible towards Gulf Coast restoration but now could steer money to places like the Great Lakes and West Coast .,"environment,federal-budget,oil-spill",health_science
False,President Obama . . . wants to mandate circumcision .,"health-care,pundits",health_science
False,The president has given 1100 special waivers to his friends for Obamacare .,health-care,health_science
True,President Obamas proposal calls for serious cuts in our own long-term carbon emissions but China and India will still be allowed to increase their emissions .,"climate-change,energy,environment",health_science
False,Planned Parenthood is nothing more than a referral service . They dont do anything except profit from killing babies and then selling body parts of those aborted babies .,"abortion,health-care,public-health,state-budget,state-finances",health_science
True,In Wisconsin deaths from domestic violence are at the highest in 10 years .,"crime,families",health_science
False,Twitter Google and Facebook are burying the FBI criminal investigation of Clinton . Very dishonest media,"elections,technology",health_science
False,Obamacare is the biggest job-killer in this country - millions of Americans have lost their jobs have been forced into part-time work .,health-care,health_science
False,AARP is endorsing the health care reform bill .,health-care,health_science
True,In Cover Florida thousands already enrolled and climbing .,health-care,health_science
True,The president of the United States . agrees with me that marriage should be between a man and a woman .,gays-and-lesbians,health_science
False,The Climatic Research Unit e-mails show that the science behind climate change has been pretty well debunked .,"climate-change,environment",health_science
False,Any child born prematurely according to the president in his own words can be killed .,abortion,health_science
True,Seventy percent of all uninsured live in households in which at least one person is working .,"families,health-care,workers",health_science
False,Ted Cruz tried to ban contraception five times .,"abortion,health-care",health_science
True,Just about half of rural hospitals operate in the red in Virginia . They operate at a loss .,health-care,health_science
False,Obama keeps talking about getting rid of all nuclear weapons . Hes already significantly reduced our capabilities there .,nuclear,health_science
False,The numbers of people that support Obamacare and like it have been steadily dropping .,"health-care,polls",health_science
False,Says North Carolina Republican Senate candidate Thom Tillis supports a plan that would end Medicare as we know it .,"federal-budget,health-care,medicare",health_science
True,A strong majority of Americans support the Keystone XL pipeline .,"energy,environment,infrastructure",health_science
True,Were now the No . 1 producer of oil in the world . Weve surpassed Saudi Arabia .,energy,health_science
False,Were going to be looking at $8 billion a day that were going to be pouring into foreign countries in order to import that make-up fuel that were going to need to take the place of what we could have gotten out of the gulf .,"energy,oil-spill,market-regulation",health_science
False,Birth control pioneer Margaret Sanger believed that people like me should be eliminated .,abortion,health_science
False,Says a trash mound on U.S. 290 is 800 feet tall .,"county-government,environment",health_science
True,Mr . Hurt would re-open that darn (Medicare) doughnut hole .,"medicare,message-machine",health_science
False,Says that all those who do not answer directly to the president theyve said (repealing Dont Ask Dont Tell) is a terrible idea .,"gays-and-lesbians,military",health_science
True,On offshore oil drilling .,"energy,oil-spill",health_science
True,No one in Rhode Island - not just children no one in Rhode Island - should eat more than one serving of freshwater fish caught in our state each month .,"animals,environment,food-safety,government-regulation,public-health",health_science
True,Says U.S. Senate rival Tammy Baldwin wants a completely government-controlled health care system that goes far beyond Obamacare and is a Medicare system for all .,"government-regulation,health-care,job-accomplishments,medicare,public-health",health_science
True,Rhode Island continues to have the highest rates of substance abuse in the country .,"Alcohol,drugs,marijuana,public-health,states",health_science
False,An image in a ChrisAbele TV ad depicts wealthy citizens who would benefit from a lake created by the controversial Estabrook Dam .,environment,health_science
False,In 2007 Ed Gillespie was paid $300000 to be the frontman for a coalition that made the individual mandate the centerpiece of its health reform plan .,"health-care,message-machine-2014",health_science
True,Oil companies can obtain an acre of public land for less than the price of a Big Mac .,"energy,environment,government-efficiency",health_science
False,Texas Governor Rick Perrys voter ID law is a blatant effort to defeat Wendy Davis by disenfranchising tens of thousands of women voters .,"elections,women",health_science
True,More than 3 million young adults . have gained insurance under (the Affordable Care Act) by staying on their familys plan .,health-care,health_science
True,The health insurance plan that (members of Congress) have is no different than any other federal employees in the United States government .,health-care,health_science
False,U.S. Rep . John Barrows plan puts the IRS in charge of your health care .,health-care,health_science
True,For every [coyote] they kill the population will replace and usually multiply .,environment,health_science
True,Says Americans invented Pong Space Invaders and the iPhone .,"economy,families,patriotism,science",health_science
False,Russ Feingold got a memo in 2009 that outlined veteran harm at a Wisconsin VA facility and nothing was done .,"drugs,public-health,veterans",health_science
True,The rate of uninsured Americans (is) 8.8 percent .,health-care,health_science
True,Says that in the recent year homeowners across Ohio have signed mineral rights agreements and I understand that over a billion dollars worth of leases have been signed to date .,environment,health_science
True,Obama s plan for health care reform ends exorbitant out-of-pocket expenses deductibles or co-pays .,health-care,health_science
True,The No . 1 cause of childhood deaths is preventable accidents .,"children,public-health,public-safety",health_science
True,Says Texas General Land Office has earned the school children of Texas $451932.89 on wind leases that haven t produced a watt of energy .,"children,education,energy,state-budget",health_science
False,Barack Obama s health care plan is to mandate health care coverage and have a universal government-run program .,health-care,health_science
False,Senator Robert Hurt voted for a bill thats raised your electric rates seven times .,energy,health_science
True,Says Donald Trump said a woman should be punished for exercising her right to choose .,abortion,health_science
True,Says Donald Trump said the U.S. should encourage Japan to get nuclear weapons .,"foreign-policy,nuclear",health_science
False,When you were casting your vote for Republicans Brian Kemp was voting for Democrats . message-machinevoting-record	doug-macginnitie	Sandy Springs City Councilman	Georgia	republican	1	1	0	0	0	a campaign commercial 789.json	half-true	I want to give every American a $5000 refundable tax credit .,health-care,health_science
False,Statistics show 2 to 3 Texas women per week have major complications and 10 women per week seek help at an ER after an abortion .,abortion,health_science
True,Some criminals have learned how to spy on Americans hacking into our home computers and looking out through the video camera attached to the screen .,"crime,technology",health_science
True,Says Indiana Gov . Mike Pence denies that theres such a thing as evolution .,"religion,science",health_science
True,Says Texas ranks first among the states in the amount of carbon dioxide emitted and toxic chemicals released into water .,"climate-change,environment,public-health,water",health_science
False,The Senate Finance Committee approved a reform proposal that has both Democratic and Republican support .,health-care,health_science
True,The costs for families (in the individual market) for the same type of coverage that they re currently receiving would go down 14 percent to 20 percent .,health-care,health_science
False,Seniors enrolled in Medicare Advantage are going to see an average premium increase between $50 and $90 per month .,"health-care,medicare",health_science
True,Says a bill requiring ultrasounds before abortions was supported by Republicans and Democrats .,abortion,health_science
True,Colorado saw increased incidents of emergency room visits by young people and increased incidents of driving while under the influence of marijuana following the legalization of recreational pot .,"marijuana,public-health,transportation",health_science
True,On opposing legislation that would take away existing health care plans .,"health-care,voting-record",health_science
True,Hillary stood up for universal health care when almost no one else would and kept standing till 6-million kids had coverage .,health-care,health_science
True,Planned Parenthood is an organization that funnels millions of dollars in political contributions to pro-abortion candidates .,"abortion,campaign-finance",health_science
True,In Congress right now were doing the best job we have ever done in women in the federal legislature but its still only 19 percent .,women,health_science
True,Attacks on Planned Parenthood come at a time when the poverty rate among women is the highest in nearly two decades and 1 in 5 women under 65 dont have access to health care .,"health-care,poverty,women",health_science
False,A clause hidden in the Obamacare bill which is now law gives Obama the right to form a private army .,"health-care,military",health_science
False,Romney signed government-mandated health care with taxpayer-funded abortions .,"abortion,message-machine-2012",health_science
True,Says the federal government tells health insurance companies how much money theyre allowed to keep of what they receive in revenues - 15 percent .,health-care,health_science
True,Says Hillary Clinton helped get done the Childrens Health Insurance Program .,health-care,health_science
False,As the number of vaccines administered to children has increased in the United States so has the autism rate .,autism,health_science
False,After Texas defunded Planned Parenthood both the unintended pregnancy and abortion rates dropped .,"abortion,women",health_science
True,Very few men outlive their own fertility .,"children,families,gays-and-lesbians,human-rights,legal-issues,marriage,science,sexuality,supreme-court",health_science
False,Obamacare will question your sex life .,"health-care,privacy",health_science
