label,statement,subjects,superlabel
False,The administration has issued rules for $1 abortions in ObamaCare and requires all persons enrolled in insurance plans that include elective abortion coverage to pay an abortion premium .,"abortion,health-care",health_science
True,Says Indiana Gov . Mike Pence advocated diverting taxpayer dollars to so-called conversion therapy .,"civil-rights,gays-and-lesbians",health_science
True,Teddy Roosevelt first called for (health care) reform nearly a century ago .,health-care,health_science
True,On supporting the Supreme Court abortion decision Roe v. Wade,abortion,health_science
False,Says Suzanne Bonamici supports the $500 billion cut to Medicare passed last year .,"health-care,medicare",health_science
False,Gas will reach $4 a gallon under a cap-and-trade plan .,"cap-and-trade,climate-change,energy,environment",health_science
False,Were losing as many people to heroin and opioid overdoses as we lost to the AIDS epidemic at its peak .,drugs,health_science
True,Says Democratic Senate candidate Bruce Braley voted to cut $700 billion from Medicare to support Obamacare .,"federal-budget,health-care,medicare,message-machine-2014",health_science
True,Preventive care coverage under the Affordable Care Act has already helped Granite Staters save money and live healthier lives .,health-care,health_science
True,In Wisconsin only half of all the adults with serious psychological distress received mental health treatment or medication .,"health-care,public-health,state-budget",health_science
True,She stood by ground zero workers who sacrificed their health after so many sacrificed their lives and kept standing till this administration took action .,health-care,health_science
True,While Exxon Mobil has 40 pages on its media response strategy its plan for resource protection is only five pages long and its plan for oil removal is just nine pages long .,"energy,environment,oil-spill",health_science
False,Exposure to the electromagnetic fields from power lines has been associated with childhood leukemia and other diseases .,"energy,infrastructure,public-health,public-safety",health_science
False,If you re a small business and don t adopt the health care plan that Senator Obama mandates he s going to fine you .,health-care,health_science
False,Under the Baucus bill . federal funds would subsidize coverage of elective abortions .,"abortion,health-care",health_science
False,Cap-and-trade is wildly unpopular with Americans .,"cap-and-trade,climate-change,energy,environment",health_science
False,As a senator Hillary Clinton paid women less than the men in her office .,women,health_science
False,Mark Warners record is one of acting against the Keystone XL pipeline .,"climate-change,energy,voting-record",health_science
True,Says Ron Johnson voted to turn Medicare into a voucher program .,"federal-budget,medicare,public-health",health_science
False,Toothpaste contains the poison substance of fluoride .,"public-health,science",health_science
True,Today we import triple the amount of oil than we had on the day Senator McCain took office .,energy,health_science
True,Said state insurance commissioner candidate Ralph Hudgens fights hard to strip women of life-saving coverage such as mammograms .,"health-care,women",health_science
False,Says legislation supported by gay rights activists would strip mother and father from future Texas birth certificates .,"children,gays-and-lesbians,legal-issues",health_science
False,Mercury is used in vaccines and there is no safe level of mercury .,public-health,health_science
False,Theres no wildlife in the Arctic National Wildlife Refuge .,"energy,environment",health_science
True,The costs of cancer and all affiliated issues are over $20 billion a year to this state .,health-care,health_science
True,President Barack Obama reduced the cost of prescription drugs for nearly 3.6 million Americans in 2011 .,"health-care,medicare,message-machine-2012",health_science
True,In Flint Mich . the pipes still havent been replaced . The water is still poisoned .,"infrastructure,public-health,urban,water",health_science
True,Here in Virginia we have the opportunity to become the first state on the East Coast to explore for and produce oil and natural gas offshore .,"energy,states",health_science
False,Health care reform : Everything about it is going to raise costs raise taxes and lower the quality of health care .,health-care,health_science
False,Said Planned Parenthoods early objective was to help kill black babies before they came into the world .,abortion,health_science
True,When the Republicans were in charge they actually expanded government health care with the prescription drug program .,"health-care,medicare,new-hampshire-2012",health_science
False,Says Charlie Crist could have expanded Medicaid after the health care law passed but didnt .,"florida,health-care,medicaid",health_science
True,Hispanic students in Florida perform the best of any Hispanic population in the United States .,"diversity,education",health_science
True,In Florida when Jeb Bush was governor state authorities conducted a deeply flawed purge of voters before the presidential election in 2000 and in2004 a plan to purge even more voters was headed off .,"diversity,elections",health_science
True,The Koch brothers are one of the biggest polluters in the country .,environment,health_science
True,ObamaCare will use your tax dollars to provide free Viagra to convicted rapists and registered sex offenders .,health-care,health_science
True,Every new Republican member of the U.S. Senate said they will vote to repeal and replace Obamacare .,health-care,health_science
True,On the Keystone XL pipeline,environment,health_science
True,At the time that (Medicare Part D) was passed (it) was actually less popular than the Affordable Care Act according to the polls .,"health-care,medicare,polls",health_science
False,Medicare officials have treated Humana and AARP inconsistently on how they can communicate with seniors .,"health-care,medicare",health_science
True,In an average grocery store roughly 75 percent of processed foods contain genetically modified organisms or GMOs .,"agriculture,animals,consumer-safety,economy,environment,government-regulation,public-health,science,technology",health_science
True,A miscarriage is considered an abortion .,abortion,health_science
True,The Iranians are now saying that what were saying the deal is and what they understand it to be are two different things .,"foreign-policy,nuclear",health_science
True,Says Rick Santorum funded Planned Parenthood .,"abortion,message-machine-2012",health_science
True,Before 2005 the percentage of Texas high school students meeting the college readiness standards of the Texas Higher Education Coordinating Board stood at 28% in English and 42% in math . Those figures stood at 65% and 66% in 2013 .,"children,education",health_science
True,The GOP platform that seeks further limits on abortion and is silent on an exception for rape has been there for more than 30 years .,abortion,health_science
True,Just remember this : the presidents health care bill put 30 million people on health care rolls that werent there before .,health-care,health_science
True,Fox News uses photo of a married couple promoting traditional marriage and the photo is actually of a same-sex couple .,gays-and-lesbians,health_science
True,Says Hillary Clintoninsists that when the progressive agenda encounters religious beliefs to the contrary those beliefs have to be changed .,"religion,women",health_science
False,Says we are going to sell this house and use the proceeds to stabilize rates .,water,health_science
False,Says 15000 IRS employees have to be added to administer ObamaCare and look at the tax implications .,health-care,health_science
False,As a senator Hillary Clinton actually paid female staffers a lot less than men .,"candidates-biography,women",health_science
False,According to recent reports a group of death panels organized under Obamacare ordered their first execution .,health-care,health_science
False,Say easing restrictions on selling alcohol on Sundays will result in more traffic crashes and fatalities .,Alcohol,health_science
False,According to the CDC 110 million Americans now have a sexually transmitted illness .,"health-care,public-health",health_science
True,Medicare does just as good if not better at keeping people healthy as Medicare Advantage .,"health-care,medicare",health_science
False,The Democratic health care plan is a government takeover of our health programs .,health-care,health_science
True,America owns 3 percent of the worlds oil but consumes 25 percent of its global reserves .,energy,health_science
False,Suicide comes from federal government largesse saying you are not worth anything but you are going to get something for nothing .,"diversity,public-health",health_science
False,Teachers will not be able to return to work after raising their children .,"education,families",health_science
True,Says Newt Gingrich aligned with Nancy Pelosi on global warming .,"climate-change,environment,message-machine-2012",health_science
False,The fact that Rick Scott is running for governor as a reformer would be funny if it wasn t so outrageous . This is a man who barely escaped imprisonment .,"candidates-biography,health-care",health_science
False,Brazil got off oil in the last 30 years .,"energy,environment,oil-spill,pundits,abc-news-week",health_science
False,Louisiana gets not one single penny from Gulf Coast offshore oil revenues .,"energy,environment,federal-budget,oil-spill",health_science
True,We ve heard talk about curbing our use of fossil fuels in nearly every State of the Union address since the oil embargo of 1973 .,energy,health_science
False,For the first time in U.S. history a personal inaction will be deemed unlawful - not purchasing a health-insurance plan,health-care,health_science
False,Bicycle ownership drops by half while obesity in Rhode Island rises by 154 percent,public-health,health_science
False,Portland Schools spend $500K to deem PBJ sandwiches racist .,"diversity,education",health_science
False,Says he cured Charlie Sheen and the island of Comoros of HIV with milk from goats which had arthritis .,"health-care,public-health,science",health_science
True,For people with insurance the only impact of the health care law is that their insurance is stronger better and more secure than it was before . Full stop . Thats it . They dont have to worry about anything else .,health-care,health_science
False,Says Donald Trump supports an agenda out there to privatize the Veterans Affairshealth care system .,"health-care,veterans",health_science
False,All of the records as far as I know about what we did with health care those are already available .,health-care,health_science
False,Says the mandate is 71 times that a childs body will be injected with a disease for immunizations .,"children,public-health",health_science
True,Twenty percent of our electricity currently comes from nuclear power plants . I think there are 104 in the United States two of them around the coast in California .,"energy,environment",health_science
False,Tells David Cicilline 94 percent of the carbon emissions which you so want to get rid of are caused by nature .,"cap-and-trade,climate-change,energy,environment,science",health_science
True,Fifty percent of the graduating class of the year 2012 will have smoked marijuana or have done illegal drugs .,"drugs,marijuana",health_science
False,As has been noted by many observers including Bill Clinton s former secretary of labor my plan does more than anybody to reduce costs .,health-care,health_science
True,The public option is not funded with public money . It s funded with private insurance premiums .,"abortion,health-care",health_science
False,On average each U.S. military working dog saves the lives of between 150 and 200 servicemen and women over the span of his career .,"animals,military",health_science
False,Because the EPA closed a lead smelter in Missouri all lead for bullets will have to come from overseas,"environment,guns",health_science
False,Donald Trump and Hillary Clinton and Bernie Sanders have the identical position on health care which is they want to put the government in charge of you and your doctor .,health-care,health_science
True,In renewable and advanced energy manufacturing projects Ohio now ranks first among the 50 states .,"energy,environment,science",health_science
True,Because of Barack Obama 32 million new people will have healthcare .,"health-care,message-machine-2012",health_science
False,An amazing 5400 jobs were lost in the first 12 months of the (smoking) bans implementation in Ohios hospitality industry alone .,public-health,health_science
True,After Massachusetts passed a mandatory health insurance law their mortality rate went down . it saved lives .,"health-care,medicaid",health_science
False,Wendy Davis opposes any limits on abortion .,abortion,health_science
False,The president released all of the oil from the Strategic Oil Reserve .,energy,health_science
True,An attack on a healthy 22-year-old homosexual man would be more protected under the law than an attack on an eight-year-old child .,gays-and-lesbians,health_science
False,On a cap-and-trade plan .,"cap-and-trade,climate-change,environment",health_science
False,The Keystone oil pipeline would employ 20000 people in the United States .,"climate-change,energy,jobs",health_science
False,Joe Garcia raised utility rates on families .,"energy,message-machine",health_science
True,Two-thirds of the top-rated hospitals in Florida were our hospitals .,"health-care,message-machine",health_science
True,The lifespan of the average American is less than that of people in nations that spend far less (on health care). . To put it bluntly we spend more and die sooner .,health-care,health_science
True,Between Austin San Antonio Houston and Dallas over 8000 same-sex couples are raising children .,"children,civil-rights,families,gays-and-lesbians,marriage",health_science
True,In three years we could find close to 50 million gallons per day through a toilet replacement program .,"environment,water",health_science
False,Says Chris Abele has had five years and hes done nothing about the Estabrook Dam .,environment,health_science
True,Youve got more people wanting to go moose hunting in New Hampshire than want Obamacare .,health-care,health_science
False,We have more hospitals that are childrens hospitals than any other state in the union . ,health-care,health_science
False,On the use of presidentially appointed commissions .,"energy,federal-budget,government-efficiency,nuclear,oil-spill,science",health_science
True,Ive never supported legislation that invades peoples choices about contraception .,"abortion,sexuality",health_science
True,Individuals with mental illnesses die an average of 25 years earlier than those without a mental illness .,"health-care,medicaid",health_science
False,Alaskas Prince William Sound is pristine now .,"environment,pundits",health_science
True,Says Scott Brown voted to give oil companies big tax breaks .,"energy,voting-record",health_science
True,In 1947 when I was born there were about 450000 lions . In the mid-70s when my kids were born there were about 100000 . Today there are less than 30000 .,"animals,environment",health_science
True,Says Mitt Romney is committed to overturning Roe vs . Wade and he supports such amendments that define a life as beginning at the moment of conception .,"abortion,legal-issues",health_science
True,Says Sierra Club sued him to stop oil and gas activity on Texas coast but we won and the turtles are fine .,"energy,environment",health_science
False,Says North Carolina Republican Senate candidate Thom Tillis called Obamacare a great idea .,health-care,health_science
False,In Oregon 12808 people were arrested for marijuana-related crimes in 2012 .,marijuana,health_science
True,The Republican budget plan says that 10 years from now if youre a 65-year-old whos eligible for Medicare you should have to pay nearly $6400 more than you would today .,medicare,health_science
False,According to a recent Congressional Budget Office report under Obamacare 7 million people will lose their employer-sponsored insurance .,"federal-budget,health-care,public-health",health_science
True,Cervical cancer in Africa is fully preventable with basic education screeningand vaccines .,"foreign-policy,health-care,public-health",health_science
False,The non-profit groupFeeding America is lying when it claimsthat one in five kids is fighting starvation daily in the United States .,"children,hunger,poverty",health_science
False,An image of nine white blondwomen shows the amazing diversity of Fox News anchors .,"diversity,women",health_science
False,The Medicare proposal by Rep . Paul Ryan R-Wis . would allow insurance companies to deny you coverage and drop you for pre-existing conditions .,"corrections-and-updates,federal-budget,health-care,medicare",health_science
False,When I came into office our vaccination rate in Texas was 65 percent . When I left two weeks ago it was 95 percent .,"corrections-and-updates,health-care,public-health",health_science
True,Central Health is the only hospital district in Texas that spends taxpayer dollars on abortions .,abortion,health_science
True,The decision to remove Chick-fil-A from Emory University was based solely on student feedback .,gays-and-lesbians,health_science
False,Women who have miscarriages could be investigated by police under legislation supported by Republican state Senate candidate Rick Gudex .,"abortion,message-machine-2012",health_science
True,The poorest in this country are women .,"families,poverty,women",health_science
False,Says when an interviewer asked Donald Trump if he treats women with respect Trump replied I cant say that .,"history,women",health_science
False,Obama only wants your children to have health insurance .,health-care,health_science
True,Says he was the only Republican to vote against creating a House panel to investigate Planned Parenthood .,"abortion,congress",health_science
True,Republican candidate for governor Nathan Deal fought to weaken Georgias rape shield law .,"criminal-justice,women",health_science
True,Were No . 1 in child hunger .,children,health_science
False,One . Thats the number of new drilling permits under the Obama administration since they came into office .,"energy,oil-spill",health_science
True,Says Hillary Clinton and Tim Kaine want to shut down shale and shut down natural gas .,"climate-change,economy,energy,environment,jobs,public-health,market-regulation,water",health_science
True,SaysBarack Obama voted for the very same language ofIndianas Religious Freedom Restoration Act when he was in the Illinois state Senate . Sexual orientation doesnt have anything to do with this law .,"civil-rights,diversity,families",health_science
True,If Senator Clinton or John McCain had stood up in previous years for increases in fuel efficiency standards . . . then we would not be in this same situation in the first place .,energy,health_science
True,Among the money spent on health care in the United States 46 cents on every dollar spent is through Medicare and Medicaid .,"federal-budget,health-care,medicare",health_science
True,Says Mitt Romney was director of a company that stole millions from Medicare .,medicare,health_science
False,Bill OBriens Tea Party legislature tried to repeal kindergarten and compulsory education defund Planned Parenthood and eliminate insurance coverage for birth control .,"abortion,education,health-care",health_science
False,Says Proposition 205 blocks market entry for new marijuana dispensaries .,marijuana,health_science
True,A majority of the American people opposed the health care law when it was signed and still oppose it today .,health-care,health_science
True,Health care reform plans being consided in Congress will finally reduce the costs of health care .,health-care,health_science
False,The Massachusetts health care plan dealt with 8 percent of our population far less than the 100 percent of American people affected by President Barack Obamas health care law .,health-care,health_science
True,Says Ken Cuccinelli tried to make it more difficult for mothers to obtain divorces .,"families,marriage",health_science
True,Incoming House Speaker Dean Cannon and incoming Senate President Mike Haridopolos have said they plan to champion efforts next legislative session to allow oil rigs off Florida s coast .,"energy,environment,oil-spill",health_science
True,The American Power Act would cut our dependence on oil in half .,"cap-and-trade,climate-change,energy,oil-spill",health_science
True,Says proposed anti-abortion legislation would force women facing the most personal of health decisions to endure a transvaginal ultrasound .,"abortion,health-care",health_science
False,Says Tommy Thompson favors Obamas health care mandate was publicly thanked by Obama for health reform support and that Thompson says we cant repeal Obamacare .,"health-care,message-machine-2012,public-health",health_science
True,On abortion rights .,abortion,health_science
True,Tallahassee is the ninth-rainiest (city) in the nation .,weather,health_science
True,After the oil spill Congressman Adam Putnam doubled down saying all energy sources including oil drilling in the Gulf should be considered just days after the oil spill started .,oil-spill,health_science
True,Global surface temperatures have been flat for 16 years .,"climate-change,energy,environment,government-regulation,history,science,weather",health_science
False,On allowing abortion in cases of rape or incest I have never said that or advocated that .,abortion,health_science
True,In South Florida weve had nine inches of sea-level rise since the 1920s .,environment,health_science
True,Washing your hands and covering your mouth when you cough makes a huge difference in reducing transmission of the flu .,health-care,health_science
True,Half of all personal bankruptcies in America are caused by medical bills .,health-care,health_science
False,In Houston Texas today there are no homeless veterans .,homeless,health_science
False,Every day about 100 people will be arrested for possession of marijuana in Georgia .,"criminal-justice,drugs,marijuana",health_science
True,Says that according to many reports and even our own data the state of Texas spent more through Medicaid on orthodontia than all other states combined .,"health-care,medicaid,public-health",health_science
True,We understand that this heroin is primarily coming from Mexico over the border .,drugs,health_science
False,Says the media created the term polar vortex and the cold air proves the ice isnt melting .,"climate-change,weather",health_science
True,Before we even passed health care 4 millions kids got health insurance that didnt have it before through the Childrens Health Insurance Program .,"families,health-care",health_science
True,Barack Obama s health care plan would leave 15 million Americans out .,health-care,health_science
False,The health care numbers are going up .,"health-care,abc-news-week",health_science
True,400000 Oregonians have gained access to health care through the Affordable Care Act .,health-care,health_science
False,20000 Kansans lost their health insurance because of (Obamacare).,"health-care,message-machine-2014",health_science
True,Drilling in ANWR would have minimal impact covering only 2000 out of 20-million acres .,energy,health_science
False,Warren Buffett recently said Scrap Obamacare and Start All Over .,"health-care,pundits",health_science
False,Says Jeanne Shaheen voted to pave the way for a new national energy tax .,"energy,voting-record",health_science
True,Says that in Ohio right now you could be 8 months pregnant and have an abortion for no reason .,abortion,health_science
True,In some states it is still legal to deny a woman coverage because she s been the victim of domestic violence .,health-care,health_science
False,Former Alaska Governor Sarah Palin was right that President Barack Obamas health care bill created what would in effect be death panels .,health-care,health_science
True,Whales live as long at SeaWorld as they do in the wild .,"animals,science,tourism",health_science
True,Things went wrong with the Medicare prescription D plan that George Bush rolled out .,"health-care,medicare,retirement,technology",health_science
True,Child care costs in some states now exceed the average price tag for college tuition .,"children,education,families",health_science
True,U.S. Senate candidate Michelle Nunn has avoided taking a stand on Obamacare .,health-care,health_science
False,More than 100000 women in Texas have attempted to self-induce abortion in the past year alone .,abortion,health_science
True,Says that in three legislative sessions his proposals opening pre-kindergarten to all Texas 4-year-olds never got heard or voted out of committee .,"children,education",health_science
True,Says when New Jersey adopted guaranteed coverage and cost provisions without a mandate individual health insurance market rates doubled or tripled and enrollment dropped from 180000 people to 80000 people .,"health-care,states",health_science
True,It used to be that the only children at school who werent vaccinated were those who had true medical conditions . Now there are 19 states that allow personal belief exemptions .,"health-care,public-health",health_science
False,In 1916 the U.S. government predicted that by the 1940s all paper would come from hemp and that no more trees would need to be cut down .,"drugs,marijuana",health_science
True,In about three weeks over a half million Floridians are going to lose their coverage again through Obamacare .,health-care,health_science
